{
  "schemaVersion": 1,
  "guideVersion": "2.0.0",
  "updatedAt": "2026-09-01",
  "categories": [
    {
      "id": "start",
      "label": "Démarrer / reprendre",
      "description": "Poser le cadre avant d'écrire du code : nouveau projet, reprise d'un repo existant ou question simple.",
      "connections": [
        "build",
        "debug",
        "session"
      ],
      "icon": "spark",
      "image": "/illustrations/start.svg",
      "mapRole": "station",
      "position": {
        "x": 200,
        "y": 380
      },
      "next": [
        "build"
      ],
      "references": []
    },
    {
      "id": "build",
      "label": "Construire",
      "description": "Implémenter — petite modification ou feature complète — du plan au diff vérifié.",
      "connections": [
        "start",
        "debug",
        "research",
        "quality"
      ],
      "icon": "blocks",
      "image": "/illustrations/build.svg",
      "mapRole": "hub",
      "position": {
        "x": 700,
        "y": 380
      },
      "next": [
        "quality"
      ],
      "references": []
    },
    {
      "id": "debug",
      "label": "Comprendre / debugger",
      "description": "Tracer une architecture ou une root cause avant de modifier quoi que ce soit.",
      "connections": [
        "start",
        "build",
        "research",
        "quality"
      ],
      "icon": "bug",
      "image": "/illustrations/debug.svg",
      "mapRole": "station",
      "position": {
        "x": 420,
        "y": 750
      },
      "next": [],
      "references": []
    },
    {
      "id": "research",
      "label": "Rechercher / décider",
      "description": "Comparer des options ou vérifier des faits externes avant une décision coûteuse à inverser.",
      "connections": [
        "build",
        "debug",
        "stack"
      ],
      "icon": "branch",
      "image": "/illustrations/research.svg",
      "mapRole": "station",
      "position": {
        "x": 980,
        "y": 130
      },
      "next": [],
      "references": []
    },
    {
      "id": "quality",
      "label": "Vérifier / reviewer",
      "description": "Obtenir des preuves — vérification puis review indépendante si le risque le justifie — avant de déclarer terminé.",
      "connections": [
        "build",
        "debug",
        "session",
        "final"
      ],
      "icon": "check",
      "image": "/illustrations/quality.svg",
      "mapRole": "station",
      "position": {
        "x": 1230,
        "y": 380
      },
      "next": [
        "final"
      ],
      "references": []
    },
    {
      "id": "final",
      "label": "Final",
      "description": "Clore proprement : vérification, review indépendante si le risque le justifie, résumé de passation et rapport [STACK].",
      "connections": [
        "quality"
      ],
      "icon": "flag",
      "image": "/illustrations/final.svg",
      "mapRole": "terminal",
      "position": {
        "x": 1620,
        "y": 380
      },
      "next": [],
      "references": [
        "verify-work",
        "fresh-review"
      ]
    },
    {
      "id": "session",
      "label": "Session / contexte",
      "description": "Garder une session cohérente : contexte, historique, travail en parallèle.",
      "connections": [
        "start",
        "quality"
      ],
      "icon": "layers",
      "image": "/illustrations/session.svg",
      "mapRole": "band",
      "position": {
        "x": 900,
        "y": 900
      },
      "next": [],
      "references": []
    },
    {
      "id": "stack",
      "label": "Stack / sécurité",
      "description": "Savoir quelle brique sert à quoi, et scanner avant d'installer une extension tierce.",
      "connections": [
        "research"
      ],
      "icon": "stack",
      "image": "/illustrations/stack.svg",
      "mapRole": "band",
      "position": {
        "x": 900,
        "y": 1030
      },
      "next": [],
      "references": []
    }
  ],
  "quickCommands": [
    {
      "id": "context",
      "label": "/context",
      "command": "/context",
      "purpose": "Voir ce qui occupe la fenêtre de contexte.",
      "tags": [
        "context",
        "tokens"
      ]
    },
    {
      "id": "compact",
      "label": "/compact",
      "command": "/compact",
      "purpose": "Compacter une session longue qui reste sur le même objectif.",
      "tags": [
        "context",
        "session"
      ]
    },
    {
      "id": "clear",
      "label": "/clear",
      "command": "/clear",
      "purpose": "Repartir proprement pour un sujet sans rapport.",
      "tags": [
        "context",
        "session"
      ]
    },
    {
      "id": "rename",
      "label": "/rename",
      "command": "/rename <nom>",
      "purpose": "Nommer une session importante pour la retrouver.",
      "tags": [
        "session"
      ]
    },
    {
      "id": "resume",
      "label": "Resume",
      "command": "claude --resume",
      "purpose": "Choisir et reprendre une session précédente.",
      "tags": [
        "session",
        "resume"
      ]
    },
    {
      "id": "continue",
      "label": "Continue",
      "command": "claude --continue",
      "purpose": "Continuer la dernière conversation pertinente.",
      "tags": [
        "session",
        "resume"
      ]
    },
    {
      "id": "headroom-doctor",
      "label": "Headroom doctor",
      "command": "headroom doctor",
      "purpose": "Diagnostiquer le routage Headroom.",
      "tags": [
        "headroom",
        "diagnostic"
      ]
    },
    {
      "id": "headroom-perf",
      "label": "Headroom perf",
      "command": "headroom perf",
      "purpose": "Voir les statistiques d'optimisation Headroom.",
      "tags": [
        "headroom",
        "tokens"
      ]
    },
    {
      "id": "claude-direct",
      "label": "Bypass Headroom",
      "command": "claude-direct",
      "purpose": "Lancer Claude sans Headroom pour comparer ou diagnostiquer.",
      "tags": [
        "headroom",
        "diagnostic"
      ]
    }
  ],
  "workflows": [
    {
      "id": "new-project",
      "category": "start",
      "title": "Nouveau projet de zéro",
      "icon": "spark",
      "summary": "Transformer une idée en architecture et premier incrément sans partir trop vite dans le code.",
      "tags": [
        "new",
        "project",
        "architecture",
        "plan",
        "zero"
      ],
      "whenToUse": [
        "Tu pars d'un dossier vide ou d'une idée encore peu structurée."
      ],
      "whenNotToUse": [
        "Le projet existe déjà et possède une architecture à comprendre."
      ],
      "stack": [
        "Agent Reach si choix techniques actuels nécessaires",
        "frontend-design si UI substantielle",
        "verification-loop avant de considérer le premier incrément terminé"
      ],
      "steps": [
        "Définir objectif utilisateur, contraintes, non-objectifs et critère de réussite.",
        "Demander 2-3 architectures seulement si le choix est réellement structurant.",
        "Rechercher les solutions existantes avant de créer une infrastructure maison.",
        "Choisir le plus petit premier incrément vertical.",
        "Créer la structure du repo et le CLAUDE.md projet.",
        "Implémenter par incréments vérifiables.",
        "Vérifier build/tests et documenter la commande de lancement."
      ],
      "promptTemplate": "Je démarre un nouveau projet :\n\n<OBJECTIF>\n\nContraintes :\n- <CONTRAINTE 1>\n- <CONTRAINTE 2>\n\nAvant de coder :\n1. clarifie l'architecture minimale nécessaire ;\n2. identifie les choix réellement structurants ;\n3. recherche les solutions existantes si une dépendance ou intégration importante est en jeu ;\n4. propose un premier incrément vertical testable ;\n5. ne crée pas d'abstraction inutile.\n\nCommence par le plan, pas par le code.",
      "antiPatterns": [
        "Demander « construis tout » sans limites.",
        "Choisir dix services avant d'avoir un premier flux vertical.",
        "Créer des abstractions pour des besoins hypothétiques."
      ],
      "related": [
        "better-implementation",
        "external-research",
        "verify-work"
      ],
      "automation": "mixed",
      "featured": true
    },
    {
      "id": "resume-project",
      "category": "start",
      "title": "Reprendre un projet existant",
      "icon": "refresh",
      "summary": "Reconstruire rapidement le contexte utile sans relire tout le repository.",
      "tags": [
        "resume",
        "existing",
        "project",
        "architecture",
        "repo"
      ],
      "whenToUse": [
        "Tu reviens après plusieurs jours/semaines ou tu découvres un repo."
      ],
      "whenNotToUse": [
        "Tu reprends simplement la même session Claude encore fraîche."
      ],
      "stack": [
        "Codebase Memory"
      ],
      "steps": [
        "Lire CLAUDE.md/README et l'état Git.",
        "Utiliser Codebase Memory pour architecture, points d'entrée et zones actives.",
        "Vérifier les conclusions importantes dans les sources.",
        "Identifier l'objectif en cours et les modifications non terminées.",
        "Ne charger ensuite que le scope utile à la prochaine tâche."
      ],
      "promptTemplate": "Familiarise-toi avec ce repository sans rien modifier.\n\nUtilise Codebase Memory pour comprendre :\n- architecture ;\n- composants principaux ;\n- points d'entrée ;\n- services externes ;\n- tests ;\n- zones à risque ;\n- état pertinent pour la prochaine tâche.\n\nVérifie ensuite les conclusions importantes dans les fichiers source.\nNe lis pas tout le repo si des requêtes ciblées suffisent.",
      "antiPatterns": [
        "Lire récursivement tout le repo.",
        "Refaire la même cartographie à chaque petite tâche."
      ],
      "related": [
        "understand-code",
        "resume-session"
      ],
      "automation": "manual"
    },
    {
      "id": "resume-session",
      "category": "session",